{"attempted_at":"2026-08-11T08:17:47.152Z","bytes_observed":379,"content_type":"text/html","corpus_admitted":false,"corpus_id":"SSA_PUBLIC_REPLAY_CORPUS_v0.1","effective_url":"https://www.ssa.gov/OP_Home/","error_text":"HTTP_ERROR:403:Forbidden","failure_body_object":"receipts/failures/body/fa0877c49967ec2eb3ab64f30f68024c10033b7b6640b67efc83aa6621c22f8d.bin","failure_class":"HTTP_STATUS","failure_headers_object":"receipts/failures/headers/713f8f5102ac2b9dd045bc5e1fe8ab5801fbd2acae7803436937ca17a248e57c.json","gate1_eligible":false,"http_status":403,"manifest_admitted":false,"protocol_id":"PUBLIC_REPLAY_PROTOCOL_v0.1","request_contact":"https://github.com/jsonwisdom/provenance-audit-kit","request_user_agent":"JSONWisdom-PublicReplay/0.1 (+https://github.com/jsonwisdom/provenance-audit-kit)","response_body_sha256":"fa0877c49967ec2eb3ab64f30f68024c10033b7b6640b67efc83aa6621c22f8d","response_headers_sha256":"713f8f5102ac2b9dd045bc5e1fe8ab5801fbd2acae7803436937ca17a248e57c","schema":"SSA_FETCH_FAILURE_v0.1","scope_id":"SSA_PUBLIC_NONMONETARY_SCOPE_001_v0.1","source_url":"https://www.ssa.gov/OP_Home/","transport_exit_code":null}
