{"attempted_at":"2026-08-11T08:48:06.8666069Z","bytes_observed":381,"content_type":"text/html","corpus_admitted":false,"corpus_id":"SSA_PUBLIC_REPLAY_CORPUS_v0.1","effective_url":"https://www.ssa.gov/OP_Home/","error_text":"HTTP_ERROR:403:Forbidden","failure_body_object":"receipts/failures/body/d2175d6f2def93591fd5d80bb6f2f3cd1c66bb8c9eb7d86c4e396730f1b7a34f.bin","failure_class":"HTTP_STATUS","failure_headers_object":"receipts/failures/headers/e48d0dc79aeed6167d4df9dfc9e4cfb7c88c8e3664519eea24aad205ffbb600a.json","gate1_eligible":false,"http_status":403,"manifest_admitted":false,"protocol_id":"PUBLIC_REPLAY_PROTOCOL_v0.1","request_contact":"https://github.com/jsonwisdom/provenance-audit-kit","request_user_agent":"JSONWisdom-PublicReplay/0.1 (+https://github.com/jsonwisdom/provenance-audit-kit)","response_body_sha256":"d2175d6f2def93591fd5d80bb6f2f3cd1c66bb8c9eb7d86c4e396730f1b7a34f","response_headers_sha256":"e48d0dc79aeed6167d4df9dfc9e4cfb7c88c8e3664519eea24aad205ffbb600a","schema":"SSA_FETCH_FAILURE_v0.1","scope_id":"SSA_PUBLIC_NONMONETARY_SCOPE_001_v0.1","source_url":"https://www.ssa.gov/OP_Home/","transport_exit_code":null}
